{
  "schema": "stage-snapshot-v1",
  "snapshot_id": "snapshot-1",
  "run_id": "run-1",
  "sequence": 1,
  "created_at": "2026-09-01T00:00:00Z",
  "snapshot_reason": "delegating_worker",
  "controller": {"id": "android-change-workflow", "authority": "stage_gate_and_requirement_acceptance"},
  "stage": {"stage_id": "stage-1", "gate_index": 1, "state": "active", "risk_level": "low"},
  "input_bindings": {
    "requirement_sha256": "1111111111111111111111111111111111111111111111111111111111111111",
    "core_policy_sha256": "2222222222222222222222222222222222222222222222222222222222222222",
    "extension_config_sha256": "3333333333333333333333333333333333333333333333333333333333333333"
  },
  "provider_resolution": {
    "selection_mode": "none",
    "coding": {"source": "core", "reason": "mode_none"},
    "execution": {"source": "core", "reason": "mode_none"}
  },
  "workspace_bindings": [],
  "event": {"type": "assignment_planned", "planned_assignment_id": "assignment-1"}
}
